{
  "schemaVersion": 1,
  "ingressMode": "http",
  "offeredMessagesPerSecond": 30,
  "workerTps": 0,
  "warmupSeconds": 120,
  "measurementSeconds": 600,
  "drainTimeoutSeconds": 120,
  "dlrEnabled": true,
  "providerResponseDelayMillis": 0,
  "providerDlrDelayMillis": 1000,
  "admissionTimeoutMillis": 10000,
  "maxOutstandingRequests": 1000,
  "maxTrackedMessages": 10000
}
